{
  "$schema": "http://json-schema.org/draft-07/schema#",
  "title": "ImplementationOutput",
  "description": "Output produced by Agent B after writing the implementation code",
  "type": "object",
  "properties": {
    "code": {
      "type": "string",
      "description": "The actual Python code written by Agent B"
    },
    "filename": {
      "type": "string",
      "description": "Suggested filename for the code"
    },
    "language": {
      "type": "string",
      "description": "Programming language used",
      "default": "python"
    },
    "dependencies": {
      "type": "array",
      "description": "Libraries needed to run the code",
      "items": {
        "type": "string"
      }
    },
    "notes": {
      "type": "string",
      "description": "Any additional notes or instructions for Agent C"
    }
  },
  "required": ["code", "filename", "language", "dependencies"]
}
