{
  "code": "class ProductManager:\n    def __init__(self):     \n        self.products = {}\n\n    def add_product(self, product_id, name, price, stock):\n        if product_id in self.products:\n            return False, \"Product already exists\"\n\n        self.products[product_id] = {\n            \"product_id\": product_id,\n            \"name\": name,\n            \"price\": price,\n            \"stock\": stock\n        }\n        return True, \"Product added successfully\"\n\n    def delete_product(self, product_id):\n        if product_id not in self.products:\n            return False, \"Product not found\"\n\n        del self.products[product_id]\n        return True, \"Product deleted successfully\"\n\n    def update_product(self, product_id, name=None, price=None, stock=None):\n        if product_id not in self.products:\n            return False, \"Product not found\"\n\n        if name is not None:\n            self.products[product_id][\"name\"] = name\n        if price is not None:\n            self.products[product_id][\"price\"] = price\n        if stock is not None:\n            self.products[product_id][\"stock\"] = stock\n\n        return True, \"Product updated successfully\"\n\n    def search_product(self, product_id):\n        if product_id not in self.products:\n            return None\n\n        return self.products[product_id]\n\n    def list_products(self):\n        return list(self.products.values())\n\n\nif __name__ == \"__main__\":\n    manager = ProductManager()\n\n    print(\"Add products:\")\n    print(manager.add_product(\"P001\", \"Laptop\", 899.99, 10))\n    print(manager.add_product(\"P002\", \"Mouse\", 19.99, 50))\n\n    print(\"\\nList products:\")\n    print(manager.list_products())\n\n    print(\"\\nSearch product P001:\")\n    print(manager.search_product(\"P001\"))\n\n    print(\"\\nUpdate product P001:\")\n    print(manager.update_product(\"P001\", price=799.99, stock=8))\n    print(manager.search_product(\"P001\"))\n\n    print(\"\\nDelete product P002:\")\n    print(manager.delete_product(\"P002\"))\n\n    print(\"\\nFinal products:\")\n    print(manager.list_products())\n",
  "filename": "product_manager.py",
  "language": "python",
  "dependencies": [],
  "notes": "Generated by Agent B Code Generator. The implementation uses in-memory dictionary storage and includes a simple command-line demonstration. Agent C can generate pytest cases based on the CRUD methods in this file."
}
